{
  "schemaVersion": "1.1.0",
  "generatedAt": "2026-08-25T14:57:53.230Z",
  "repository": {
    "name": "strix",
    "source": "https://github.com/usestrix/strix",
    "languages": {
      "Python": 88.1,
      "TypeScript": 11.9
    },
    "fileCount": 10,
    "sourceFileCount": 8,
    "parsedFileCount": 8,
    "lines": 108,
    "fingerprint": {
      "languages": [
        "Python",
        "TypeScript"
      ],
      "languageFileCounts": {
        "Python": 7,
        "TypeScript": 1
      },
      "frameworks": [
        "FastAPI",
        "Next.js",
        "React"
      ],
      "infrastructure": [],
      "databases": [],
      "externalSystems": [
        "HTTPX"
      ],
      "testing": [],
      "buildTools": [],
      "tooling": [
        "Tailwind CSS"
      ]
    }
  },
  "technologies": [
    "FastAPI",
    "HTTPX",
    "Next.js",
    "React",
    "SQL database",
    "SQLAlchemy"
  ],
  "files": [
    {
      "id": "file:pyproject.toml",
      "path": "pyproject.toml",
      "language": "Configuration",
      "lines": 6,
      "bytes": 350,
      "hash": "strix_p1",
      "role": "source",
      "parsed": false,
      "error": null
    },
    {
      "id": "file:package.json",
      "path": "package.json",
      "language": "Configuration",
      "lines": 1,
      "bytes": 350,
      "hash": "strix_p2",
      "role": "source",
      "parsed": false,
      "error": null
    },
    {
      "id": "file:strix/main.py",
      "path": "strix/main.py",
      "language": "Python",
      "lines": 9,
      "bytes": 900,
      "hash": "strix_1",
      "role": "source",
      "parsed": true,
      "error": null
    },
    {
      "id": "file:strix/api/routes.py",
      "path": "strix/api/routes.py",
      "language": "Python",
      "lines": 18,
      "bytes": 1100,
      "hash": "strix_2",
      "role": "source",
      "parsed": true,
      "error": null
    },
    {
      "id": "file:strix/core/scanner.py",
      "path": "strix/core/scanner.py",
      "language": "Python",
      "lines": 14,
      "bytes": 1200,
      "hash": "strix_3",
      "role": "source",
      "parsed": true,
      "error": null
    },
    {
      "id": "file:strix/services/agent.py",
      "path": "strix/services/agent.py",
      "language": "Python",
      "lines": 13,
      "bytes": 950,
      "hash": "strix_4",
      "role": "source",
      "parsed": true,
      "error": null
    },
    {
      "id": "file:strix/models/scan.py",
      "path": "strix/models/scan.py",
      "language": "Python",
      "lines": 17,
      "bytes": 650,
      "hash": "strix_5",
      "role": "source",
      "parsed": true,
      "error": null
    },
    {
      "id": "file:strix/tools/crawler.py",
      "path": "strix/tools/crawler.py",
      "language": "Python",
      "lines": 8,
      "bytes": 750,
      "hash": "strix_6",
      "role": "source",
      "parsed": true,
      "error": null
    },
    {
      "id": "file:strix/tools/fuzzer.py",
      "path": "strix/tools/fuzzer.py",
      "language": "Python",
      "lines": 10,
      "bytes": 800,
      "hash": "strix_7",
      "role": "source",
      "parsed": true,
      "error": null
    },
    {
      "id": "file:app/page.tsx",
      "path": "app/page.tsx",
      "language": "TypeScript",
      "lines": 12,
      "bytes": 900,
      "hash": "strix_8",
      "role": "source",
      "parsed": true,
      "error": null
    }
  ],
  "symbols": [
    {
      "id": "strix/main.py",
      "type": "module",
      "name": "main.py",
      "file": "strix/main.py",
      "line": 1,
      "end_line": 9,
      "parent": null,
      "exported": false,
      "evidence": []
    },
    {
      "id": "strix/api/routes.py",
      "type": "module",
      "name": "routes.py",
      "file": "strix/api/routes.py",
      "line": 1,
      "end_line": 18,
      "parent": null,
      "exported": false,
      "evidence": []
    },
    {
      "id": "strix/api/routes.py::start_security_scan",
      "type": "function",
      "name": "start_security_scan",
      "file": "strix/api/routes.py",
      "line": 10,
      "end_line": 12,
      "parent": null,
      "exported": true,
      "evidence": []
    },
    {
      "id": "strix/api/routes.py::get_scan_report",
      "type": "function",
      "name": "get_scan_report",
      "file": "strix/api/routes.py",
      "line": 15,
      "end_line": 17,
      "parent": null,
      "exported": true,
      "evidence": []
    },
    {
      "id": "strix/core/scanner.py",
      "type": "module",
      "name": "scanner.py",
      "file": "strix/core/scanner.py",
      "line": 1,
      "end_line": 14,
      "parent": null,
      "exported": false,
      "evidence": []
    },
    {
      "id": "strix/core/scanner.py::SecurityScanner",
      "type": "class",
      "name": "SecurityScanner",
      "file": "strix/core/scanner.py",
      "line": 6,
      "end_line": 13,
      "parent": null,
      "exported": true,
      "evidence": []
    },
    {
      "id": "strix/core/scanner.py::SecurityScanner::__init__",
      "type": "method",
      "name": "__init__",
      "file": "strix/core/scanner.py",
      "line": 7,
      "end_line": 9,
      "parent": "strix/core/scanner.py::SecurityScanner",
      "exported": true,
      "evidence": []
    },
    {
      "id": "strix/core/scanner.py::SecurityScanner::scan_endpoints",
      "type": "method",
      "name": "scan_endpoints",
      "file": "strix/core/scanner.py",
      "line": 11,
      "end_line": 13,
      "parent": "strix/core/scanner.py::SecurityScanner",
      "exported": true,
      "evidence": []
    },
    {
      "id": "strix/services/agent.py",
      "type": "module",
      "name": "agent.py",
      "file": "strix/services/agent.py",
      "line": 1,
      "end_line": 13,
      "parent": null,
      "exported": false,
      "evidence": []
    },
    {
      "id": "strix/services/agent.py::PentestAgent",
      "type": "class",
      "name": "PentestAgent",
      "file": "strix/services/agent.py",
      "line": 5,
      "end_line": 12,
      "parent": null,
      "exported": true,
      "evidence": []
    },
    {
      "id": "strix/services/agent.py::PentestAgent::run_audit",
      "type": "method",
      "name": "run_audit",
      "file": "strix/services/agent.py",
      "line": 6,
      "end_line": 9,
      "parent": "strix/services/agent.py::PentestAgent",
      "exported": true,
      "evidence": []
    },
    {
      "id": "strix/services/agent.py::PentestAgent::get_report",
      "type": "method",
      "name": "get_report",
      "file": "strix/services/agent.py",
      "line": 11,
      "end_line": 12,
      "parent": "strix/services/agent.py::PentestAgent",
      "exported": true,
      "evidence": []
    },
    {
      "id": "strix/models/scan.py",
      "type": "module",
      "name": "scan.py",
      "file": "strix/models/scan.py",
      "line": 1,
      "end_line": 17,
      "parent": null,
      "exported": false,
      "evidence": []
    },
    {
      "id": "strix/models/scan.py::ScanRequest",
      "type": "database_model",
      "name": "ScanRequest",
      "file": "strix/models/scan.py",
      "line": 5,
      "end_line": 7,
      "parent": null,
      "exported": true,
      "evidence": [
        "inherits from an ORM model base"
      ]
    },
    {
      "id": "strix/models/scan.py::VulnerabilityReport",
      "type": "database_model",
      "name": "VulnerabilityReport",
      "file": "strix/models/scan.py",
      "line": 9,
      "end_line": 11,
      "parent": null,
      "exported": true,
      "evidence": [
        "inherits from an ORM model base"
      ]
    },
    {
      "id": "strix/models/scan.py::ScanResult",
      "type": "database_model",
      "name": "ScanResult",
      "file": "strix/models/scan.py",
      "line": 13,
      "end_line": 16,
      "parent": null,
      "exported": true,
      "evidence": [
        "inherits from an ORM model base"
      ]
    },
    {
      "id": "strix/tools/crawler.py",
      "type": "module",
      "name": "crawler.py",
      "file": "strix/tools/crawler.py",
      "line": 1,
      "end_line": 8,
      "parent": null,
      "exported": false,
      "evidence": []
    },
    {
      "id": "strix/tools/crawler.py::WebCrawler",
      "type": "class",
      "name": "WebCrawler",
      "file": "strix/tools/crawler.py",
      "line": 2,
      "end_line": 7,
      "parent": null,
      "exported": true,
      "evidence": []
    },
    {
      "id": "strix/tools/crawler.py::WebCrawler::__init__",
      "type": "method",
      "name": "__init__",
      "file": "strix/tools/crawler.py",
      "line": 3,
      "end_line": 4,
      "parent": "strix/tools/crawler.py::WebCrawler",
      "exported": true,
      "evidence": []
    },
    {
      "id": "strix/tools/crawler.py::WebCrawler::discover_endpoints",
      "type": "method",
      "name": "discover_endpoints",
      "file": "strix/tools/crawler.py",
      "line": 6,
      "end_line": 7,
      "parent": "strix/tools/crawler.py::WebCrawler",
      "exported": true,
      "evidence": []
    },
    {
      "id": "strix/tools/fuzzer.py",
      "type": "module",
      "name": "fuzzer.py",
      "file": "strix/tools/fuzzer.py",
      "line": 1,
      "end_line": 10,
      "parent": null,
      "exported": false,
      "evidence": []
    },
    {
      "id": "strix/tools/fuzzer.py::ApiFuzzer",
      "type": "class",
      "name": "ApiFuzzer",
      "file": "strix/tools/fuzzer.py",
      "line": 4,
      "end_line": 9,
      "parent": null,
      "exported": true,
      "evidence": []
    },
    {
      "id": "strix/tools/fuzzer.py::ApiFuzzer::__init__",
      "type": "method",
      "name": "__init__",
      "file": "strix/tools/fuzzer.py",
      "line": 5,
      "end_line": 6,
      "parent": "strix/tools/fuzzer.py::ApiFuzzer",
      "exported": true,
      "evidence": []
    },
    {
      "id": "strix/tools/fuzzer.py::ApiFuzzer::audit_routes",
      "type": "method",
      "name": "audit_routes",